{"accepted_ses_created":false,"calibration_id":"task199.excluded-calibration.02","distribution_authorized":false,"excluded_from_pilot_denominator":true,"excluded_from_source_and_slot_counts":true,"expected_decision_visible":false,"gate_a_go":false,"h1_assigned":false,"h2_assigned":false,"not_a_human_decision":true,"packet_status":"DRAFT_NOT_DISTRIBUTABLE","record_type":"pilot_v4_excluded_calibration_packet","response":{"completion_status":"not_started","finding":"not_recorded","rationale":"","repair_actions":[]},"review_prompts":["Apply the Task194 audio-only-before-A/V reasoning order.","Assess speech dominance and transcriptive substitution risk.","Do not count generic background sound as answer-bearing audio."],"reviewer":{"completed_at":null,"reviewer_id":null,"started_at":null,"training_attested":false},"scenario":"An interval is dominated by intelligible speech while a faint generic click or hum is audible in the background.","schema_version":"1.0.0","source_group_id":null,"source_id":null,"synthetic_text_only":true}
